{"$schema":"https://json-schema.org/draft/2020-12/schema","type":"object","additionalProperties":false,"required":["schema_version","receipt_id","operation_id","idempotency_key","sku_id","state","old_passport","new_passport","archive_receipt","lock_id","optimistic_lock_status","canonical_pointer_count","downstream_invalidation_status","rollback_status","publication_authority","committed_at"],"properties":{"schema_version":{"const":"1.0"},"receipt_id":{"type":"string","pattern":"^PSP-RECREATE-[A-Z0-9._-]+$"},"operation_id":{"type":"string","minLength":1},"idempotency_key":{"type":"string","minLength":16},"sku_id":{"type":"string","minLength":1},"state":{"enum":["RECREATE_PREFLIGHT","ARCHIVE_PREPARED","NEW_PASSPORT_BUILDING","SWITCH_COMMITTED","RECREATE_FAILED"]},"old_passport":{"$ref":"#/$defs/passport"},"new_passport":{"oneOf":[{"type":"null"},{"$ref":"#/$defs/passport"}]},"archive_receipt":{"$ref":"#/$defs/binding"},"lock_id":{"type":"string","minLength":1},"optimistic_lock_status":{"enum":["PASS","FAIL"]},"canonical_pointer_count":{"type":"integer","minimum":0,"maximum":1},"downstream_invalidation_status":{"enum":["NOT_STARTED","STALE_BINDINGS_RECORDED","FAILED"]},"rollback_status":{"enum":["NOT_REQUIRED","COMPLETED","RECOVERY_REQUIRED"]},"publication_authority":{"const":"NOT_GRANTED"},"committed_at":{"type":["string","null"],"format":"date-time"}},"allOf":[{"if":{"properties":{"state":{"const":"SWITCH_COMMITTED"}},"required":["state"]},"then":{"properties":{"new_passport":{"$ref":"#/$defs/passport"},"canonical_pointer_count":{"const":1},"downstream_invalidation_status":{"const":"STALE_BINDINGS_RECORDED"},"rollback_status":{"const":"NOT_REQUIRED"},"committed_at":{"type":"string","format":"date-time"}}}},{"if":{"properties":{"state":{"const":"RECREATE_FAILED"}},"required":["state"]},"then":{"properties":{"rollback_status":{"enum":["COMPLETED","RECOVERY_REQUIRED"]},"committed_at":{"const":null}}}}],"$defs":{"binding":{"type":"object","additionalProperties":false,"required":["ref","sha256"],"properties":{"ref":{"type":"string"},"sha256":{"type":"string","pattern":"^[a-f0-9]{64}$"}}},"passport":{"type":"object","additionalProperties":false,"required":["passport_id","passport_lineage_id","version","path","sha256","lifecycle_status"],"properties":{"passport_id":{"type":"string"},"passport_lineage_id":{"type":"string"},"version":{"type":"string"},"path":{"type":"string"},"sha256":{"type":"string","pattern":"^[a-f0-9]{64}$"},"lifecycle_status":{"enum":["ACTIVE","ARCHIVED","STAGING","QUARANTINED"]}}}}}
